book_authors,book_title,image_url,book_authors_init,book_title_init,keywords
steven_d._levitt stephen_j._dubner,"freakonomics:_a_rogue_economist_explores_the_hidden_side_of_everything_(freakonomics,_#1)",https://images.gr-assets.com/books/1327909092l/1202.jpg,Steven D. Levitt|Stephen J. Dubner,"Freakonomics: A Rogue Economist Explores the Hidden Side of Everything (Freakonomics, #1)",steven_d._levitt stephen_j._dubner crime freakonomics economics economist economics represents economist ask
david_nicholls,one_day,https://images.gr-assets.com/books/1327873020l/6280118.jpg,David Nicholls,One Day,david_nicholls dexter mayhew 1988 dexter emma morley mayhew emma dexter
joseph_campbell bill_moyers,the_power_of_myth,https://images.gr-assets.com/books/1327878742l/35519.jpg,Joseph Campbell|Bill Moyers,The Power of Myth,joseph_campbell bill_moyers mythology song mythology people mythology power myth myth launched
anne_morrow_lindbergh,gift_from_the_sea,https://images.gr-assets.com/books/1328312670l/77295.jpg,Anne Morrow Lindbergh,Gift from the Sea,anne_morrow_lindbergh lindbergh life lindbergh daughter lindbergh describes introduction lindbergh lindbergh musings
helen_keller,the_story_of_my_life,https://images.gr-assets.com/books/1320429331l/821611.jpg,Helen Keller,The Story of My Life,helen_keller published keller keller story helen keller life helen keller reveals
toni_morrison,song_of_solomon,https://images.gr-assets.com/books/1451448230l/11334.jpg,Toni Morrison,Song of Solomon,toni_morrison milkman dead follows milkman milkman dead born age story
jonathan_franzen,the_corrections,https://images.gr-assets.com/books/1355011305l/3805.jpg,Jonathan Franzen,The Corrections,jonathan_franzen franzen novel medication alfred novel corrections novel bookjonathan franzen
stephen_king,under_the_dome,https://images.gr-assets.com/books/1511289992l/6320534.jpg,Stephen King,Under the Dome,stephen_king wreckage gardener town newspaper severed dome newspaper maine town
toni_morrison,the_bluest_eye,https://images.gr-assets.com/books/1388208495l/11337.jpg,Toni Morrison,The Bluest Eye,toni_morrison bluest eye morrison novel blue eyed novel book eyed children
henry_james patricia_crick,the_portrait_of_a_lady,https://images.gr-assets.com/books/1502148606l/264.jpg,Henry James|Patricia Crick,The Portrait of a Lady,henry_james patricia_crick isabel tale isabel archer marry isabel poignancy isabel isabel
elie_wiesel marion_wiesel françois_mauriac,night,https://images.gr-assets.com/books/1473495285l/1617.jpg,Elie Wiesel|Marion Wiesel|François Mauriac,Night,elie_wiesel marion_wiesel françois_mauriac elie wiesel 1944 auschwitz transylvania elie wiesel memories wiesel testimony
neal_stephenson,cryptonomicon,https://images.gr-assets.com/books/1327931476l/816.jpg,Neal Stephenson,Cryptonomicon,neal_stephenson cryptonomicon crypt analyst suspicious secrecy germans suspicious crypt
sharon_creech,walk_two_moons,https://images.gr-assets.com/books/1389035862l/53496.jpg,Sharon Creech,Walk Two Moons,sharon_creech story spin story love disappearing mother missing mother tales
dr._seuss,"one_fish,_two_fish,_red_fish,_blue_fish",https://images.gr-assets.com/books/1165640023l/7770.jpg,Dr. Seuss,"One Fish, Two Fish, Red Fish, Blue Fish",dr._seuss fish fish fish beginner blue fish red fish fish 1960
shannon_hale,princess_academy,https://images.gr-assets.com/books/1349410861l/85990.jpg,Shannon Hale,Princess Academy,shannon_hale princess miri future princess miri lives learn princess princess
kate_dicamillo,because_of_winn-dixie,https://images.gr-assets.com/books/1456871914l/357664.jpg,Kate DiCamillo,Because of Winn-Dixie,kate_dicamillo bestseller newbery dixie preacher kate dicamillo winn dixie published novel
jhumpa_lahiri,the_namesake,https://images.gr-assets.com/books/1480106986l/33917.jpg,Jhumpa Lahiri,The Namesake,jhumpa_lahiri writer indian bestseller immigrant jhumpa lahiri lahiri interpreter generations lahiri
haruki_murakami alfred_birnbaum,hard-boiled_wonderland_and_the_end_of_the_world,https://images.gr-assets.com/books/1399844477l/10374.jpg,Haruki Murakami|Alfred Birnbaum,Hard-Boiled Wonderland and the End of the World,haruki_murakami alfred_birnbaum boiled wonderland narrative particle roaring novel wonderland wonderland end
dan_brown,digital_fortress,https://images.gr-assets.com/books/1360095966l/11125.jpg,Dan Brown,Digital Fortress,dan_brown powerful cia cryptographer susan vinci code cia nsa nsa invincible
thomas_mann john_e._woods,the_magic_mountain,https://images.gr-assets.com/books/1403170928l/88077.jpg,Thomas Mann|John E. Woods,The Magic Mountain,thomas_mann john_e._woods magic mountain swiss alps alps mountain alps community
patrick_ness jim_kay siobhan_dowd,a_monster_calls,https://images.gr-assets.com/books/1485991317l/8621462.jpg,Patrick Ness|Jim Kay|Siobhan Dowd,A Monster Calls,patrick_ness jim_kay siobhan_dowd monster conor unexpected monstrous expecting nightmare haunting darkly wakes monster
becca_fitzpatrick,finale,https://images.gr-assets.com/books/1362408156l/12751687.jpg,Becca Fitzpatrick,Finale,becca_fitzpatrick patch nora nora patch conquer nora nora convince nora unwitting
walter_m._miller_jr.,a_canticle_for_leibowitz,https://images.gr-assets.com/books/1450516880l/164154.jpg,Walter M. Miller Jr.,A Canticle for Leibowitz,walter_m._miller_jr. leibowitz story isaac leibowitz leibowitz canticle leibowitz leibowitz true
p.l._travers mary_shepard,mary_poppins,https://images.gr-assets.com/books/1327947805l/152380.jpg,P.L. Travers|Mary Shepard,Mary Poppins,p.l._travers mary_shepard mary poppins poppins day poppins mr banks poppins arrives
john_green,an_abundance_of_katherines,https://images.gr-assets.com/books/1360206426l/49750.jpg,John Green,An Abundance of Katherines,john_green katherines colin katherine predictability underlying katherine katherine thought katherine colin
ann_brashares,the_sisterhood_of_the_traveling_pants,https://images.gr-assets.com/books/1461611233l/452306.jpg,Ann Brashares,The Sisterhood of the Traveling Pants,ann_brashares carmen thinks perfectly carmen carmen decides summer carmen carmen
e.m._forster,howards_end,https://images.gr-assets.com/books/1385160500l/3102.jpg,E.M. Forster,Howards End,e.m._forster husband smug english family woman refuses pretensions husband intelligent woman
koushun_takami yuji_oniki,battle_royale,https://images.gr-assets.com/books/1331235272l/57891.jpg,Koushun Takami|Yuji Oniki,Battle Royale,koushun_takami yuji_oniki battle royale koushun takami published japan thriller based takami notorious
karen_marie_moning,dreamfever,https://images.gr-assets.com/books/1429621657l/6050298.jpg,Karen Marie Moning,Dreamfever,karen_marie_moning fae master fae fae prince erotic fae fae worlds
allen_ginsberg william_carlos_williams,howl_and_other_poems,https://images.gr-assets.com/books/1327870926l/6295.jpg,Allen Ginsberg|William Carlos Williams,Howl and Other Poems,allen_ginsberg william_carlos_williams prophetic poem poem obscene poem launched poems freed howl poems
cassandra_clare,city_of_ashes,https://images.gr-assets.com/books/1432730356l/1582996.jpg,Cassandra Clare,City of Ashes,cassandra_clare jace clary clary clary stop clary chance clary fray
kristin_cashore,fire,https://images.gr-assets.com/books/1331535456l/6137154.jpg,Kristin Cashore,Fire,kristin_cashore prince brigan plot king especially prince young king prince
markus_zusak,i_am_the_messenger,https://images.gr-assets.com/books/1398483261l/19057.jpg,Markus Zusak,I Am the Messenger,markus_zusak heartsed kennedy protect diamondssurvive diamondssurvive clubsdig robbery ace kennedy
ray_bradbury,something_wicked_this_way_comes,https://images.gr-assets.com/books/1409596011l/248596.jpg,Ray Bradbury,Something Wicked This Way Comes,ray_bradbury halloween halloween week pandemonium shadow carnival cooger dark
sylvia_day,reflected_in_you,https://images.gr-assets.com/books/1477802540l/13596809.jpg,Sylvia Day,Reflected in You,sylvia_day gideon cross gideon tormented damaged tormented cross beautiful
ned_vizzini,it's_kind_of_a_funny_story,https://images.gr-assets.com/books/1420629730l/248704.jpg,Ned Vizzini,It's Kind of a Funny Story,ned_vizzini craig suicidal teenager craig kills craig craig gilner craig finally
robert_a._heinlein,starship_troopers,https://images.gr-assets.com/books/1533117961l/17214.jpg,Robert A. Heinlein,Starship Troopers,robert_a._heinlein interstellar war space war war fourth war later fourth interstellar
olive_ann_burns,cold_sassy_tree,https://images.gr-assets.com/books/1223675895l/306654.jpg,Olive Ann Burns,Cold Sassy Tree,olive_ann_burns sassy georgia cold sassy sassy scandal adventures bestseller timeless
jorge_luis_borges andrew_hurley,collected_fictions,https://images.gr-assets.com/books/1386924676l/17961.jpg,Jorge Luis Borges|Andrew Hurley,Collected Fictions,jorge_luis_borges andrew_hurley luis borges english borges greatest spanish language writer borges talent
robert_a._heinlein,the_moon_is_a_harsh_mistress,https://images.gr-assets.com/books/1348768309l/16690.jpg,Robert A. Heinlein,The Moon is a Harsh Mistress,robert_a._heinlein tale revolution revolt revolution known revolt committed revolution
kerstin_gier anthea_bell,ruby_red,https://images.gr-assets.com/books/1312036605l/8835379.jpg,Kerstin Gier|Anthea Bell,Ruby Red,kerstin_gier anthea_bell gwyneth shepherd unexpectedly gwyneth gwyneth gideon essential gwyneth gwyneth
ellen_hopkins,crank,https://images.gr-assets.com/books/1388192181l/270730.jpg,Ellen Hopkins,Crank,ellen_hopkins crank kristina kristina character girl kristina monster kristina kristina discovers
james_dashner,the_death_cure,https://images.gr-assets.com/books/1303997647l/7864437.jpg,James Dashner,The Death Cure,james_dashner survive wicked line wicked wicked doesn wicked terrifying thomas
sylvain_reynard,gabriel's_inferno,https://images.gr-assets.com/books/1301789770l/10140661.jpg,Sylvain Reynard,Gabriel's Inferno,sylvain_reynard gabriel inferno redemption gabriel professor gabriel gabriel emerson respected dante
tahereh_mafi,unravel_me,https://images.gr-assets.com/books/1340287622l/13104080.jpg,Tahereh Mafi,Unravel Me,tahereh_mafi trilogy alexandra trilogy queen series minds trilogy shatter series
kelley_armstrong,the_reckoning,https://images.gr-assets.com/books/1327154591l/6468666.jpg,Kelley Armstrong,The Reckoning,kelley_armstrong unfortunately chloe created chloe chloe chloe struggling chloe happens
jamie_mcguire,walking_disaster,https://images.gr-assets.com/books/1352338368l/15745950.jpg,Jamie McGuire,Walking Disaster,jamie_mcguire love travis story travis travis maddox life travis travis
marissa_meyer,cress,https://images.gr-assets.com/books/1470057005l/13206828.jpg,Marissa Meyer,Cress,marissa_meyer chronicles cinder scarlet cinder thorne fugitives captain thorne cinder captain
richard_bach,illusions:_the_adventures_of_a_reluctant_messiah,https://images.gr-assets.com/books/1353964306l/29946.jpg,Richard Bach,Illusions: The Adventures of a Reluctant Messiah,richard_bach bach belief lift messiahs richard imagination clouds messiahs
jane_austen tony_tanner ros_ballaster,sense_and_sensibility,https://images.gr-assets.com/books/1397245675l/14935.jpg,Jane Austen|Tony Tanner|Ros Ballaster,Sense and Sensibility,jane_austen tony_tanner ros_ballaster require marianne love edition sensibility personal conceal romantic love require
brian_selznick,the_invention_of_hugo_cabret,https://images.gr-assets.com/books/1422312376l/9673436.jpg,Brian Selznick,The Invention of Hugo Cabret,brian_selznick thief hugo hugo undercover hugo lives station hugo orphan clock
agatha_christie,death_on_the_nile,https://images.gr-assets.com/books/1486837149l/131359.jpg,Agatha Christie,Death on the Nile,agatha_christie ridgeway shot cruise nile tranquillity cruise pistol head trigger exotic
f._scott_fitzgerald,tender_is_the_night,https://images.gr-assets.com/books/1438797669l/46164.jpg,F. Scott Fitzgerald,Tender Is the Night,f._scott_fitzgerald tender night character tender 1920s tender dick nicole tragic romance
douglas_adams,the_restaurant_at_the_end_of_the_universe,https://images.gr-assets.com/books/1521213881l/8695.jpg,Douglas Adams,The Restaurant at the End of the Universe,douglas_adams galaxy tricia facing annihilation tricia mcmilan trillian warlike vogons
edith_wharton,ethan_frome,https://images.gr-assets.com/books/1389822254l/5246.jpg,Edith Wharton,Ethan Frome,edith_wharton ethan frome girl ethan edith wharton ethan ethan finds
richard_yates,revolutionary_road,https://images.gr-assets.com/books/1353721885l/48328.jpg,Richard Yates,Revolutionary Road,richard_yates frank april april wheeler april mortgage 1950s frank shows frank
sophocles j.e._thomas,antigone,https://images.gr-assets.com/books/1486701308l/7728.jpg,Sophocles|J.E. Thomas,Antigone,sophocles j.e._thomas jocasta antigone daughter oedipus oedipus jocasta oedipus oedipus lingers
juliet_marillier,daughter_of_the_forest,https://images.gr-assets.com/books/1343589988l/13928.jpg,Juliet Marillier,Daughter of the Forest,juliet_marillier sorcha seventh sorcha despairs lovely sorcha spell sorcha sorcha kidnapped
scott_westerfeld,specials,https://images.gr-assets.com/books/1390340887l/24765.jpg,Scott Westerfeld,Specials,scott_westerfeld tally remember tally ordinary tally world better tally chills tally
richelle_mead,the_golden_lily,https://images.gr-assets.com/books/1360599818l/8709523.jpg,Richelle Mead,The Golden Lily,richelle_mead vampires alchemists sydney love sydney sage sydney loyalties sage alchemist
elizabeth_george_speare,the_witch_of_blackbird_pond,https://images.gr-assets.com/books/1345499790l/703292.jpg,Elizabeth George Speare,The Witch of Blackbird Pond,elizabeth_george_speare witch blackbird kit tyler kit friendship orphaned kit friendship witch
j.r.r._tolkien peter_beagle,the_two_towers,https://images.gr-assets.com/books/1298415523l/15241.jpg,J.R.R. Tolkien|Peter Beagle,The Two Towers,j.r.r._tolkien peter_beagle fellowship ring guide gollum destroyed mordor kingdom sauron gollum deceitful
katja_millay,the_sea_of_tranquility,https://images.gr-assets.com/books/1465919812l/16151178.jpg,Katja Millay,The Sea of Tranquility,katja_millay learn secrets girl miracle world magic life seventeen josh
john_irving,the_hotel_new_hampshire,https://images.gr-assets.com/books/1318013543l/11768.jpg,John Irving,The Hotel New Hampshire,john_irving illusions bears father illusions bears survive bear freud animal
terry_pratchett,small_gods,https://images.gr-assets.com/books/1390899426l/34484.jpg,Terry Pratchett,Small Gods,terry_pratchett miracle religion miracle tortoise manifestation mean miracle religion controversial
james_frey,a_million_little_pieces,https://images.gr-assets.com/books/1483206985l/1241.jpg,James Frey,A Million Little Pieces,james_frey frey author author million frey publisher frey claims publisher stated
jules_verne anthony_bonner,twenty_thousand_leagues_under_the_sea,https://images.gr-assets.com/books/1494979127l/33507.jpg,Jules Verne|Anthony Bonner,Twenty Thousand Leagues Under the Sea,jules_verne anthony_bonner captain nemo nemo aronnax nemo mission remarkable submarine aronnax explore
ray_bradbury,dandelion_wine,https://images.gr-assets.com/books/1374049845l/50033.jpg,Ray Bradbury,Dandelion Wine,ray_bradbury timeless summer summer life summer 28 summer boy summer
leon_uris,exodus,https://images.gr-assets.com/books/1359742531l/42697.jpg,Leon Uris,Exodus,leon_uris exodus exodus international israeli freedom novel twentieth novel
jeaniene_frost,one_foot_in_the_grave,https://images.gr-assets.com/books/1373857981l/2168860.jpg,Jeaniene Frost,One Foot in the Grave,jeaniene_frost cat crawfield vampire cat agent cat half vampire help vampire
laurell_k._hamilton,guilty_pleasures,https://images.gr-assets.com/books/1388207930l/30281.jpg,Laurell K. Hamilton,Guilty Pleasures,laurell_k._hamilton anita blake vampire jean powerful vampire slayings anita vampire
mary_doria_russell,the_sparrow,https://images.gr-assets.com/books/1525457306l/334176.jpg,Mary Doria Russell,The Sparrow,mary_doria_russell 2019 humanity extraterrestrial life extraterrestrial humanity proof extraterrestrial
jeffrey_archer,kane_and_abel,https://images.gr-assets.com/books/1388965561l/78983.jpg,Jeffrey Archer,Kane and Abel,jeffrey_archer born day kane abel abel battle generations war born
jandy_nelson,i'll_give_you_the_sun,https://images.gr-assets.com/books/1451382614l/20820994.jpg,Jandy Nelson,I'll Give You the Sun,jandy_nelson jude meets story jude daredevil jude jude twin jude
brandon_sanderson,words_of_radiance,https://images.gr-assets.com/books/1507307927l/17332218.jpg,Brandon Sanderson,Words of Radiance,brandon_sanderson king dalinar troubled shallan kaladin dalinar widely assassin szeth
p.c._cast kristin_cast,burned,https://images.gr-assets.com/books/1327944437l/6917952.jpg,P.C. Cast|Kristin Cast,Burned,p.c._cast kristin_cast zoey fate helping zoey stipulates zoey zoey threathens night zoey
lisa_genova,still_alice,https://images.gr-assets.com/books/1236089972l/2153405.jpg,Lisa Genova,Still Alice,lisa_genova alzheimer alzheimer disease onset alzheimer alice struggles forgetfulness
winston_groom,forrest_gump,https://images.gr-assets.com/books/1385313197l/186190.jpg,Winston Groom,Forrest Gump,winston_groom forrest gump meet forrest forrest gump lovable war hero
scott_lynch,the_lies_of_locke_lamora,https://images.gr-assets.com/books/1386924569l/127455.jpg,Scott Lynch,The Lies of Locke Lamora,scott_lynch ambitious locke daring thieves brilliant locke thieving locke thieves story
charlaine_harris,definitely_dead,https://images.gr-assets.com/books/1468562748l/140079.jpg,Charlaine Harris,Definitely Dead,charlaine_harris sookie stackhouse sookie life sookie claiming waitress sookie sookie
l.j._smith,"night_world,_no._1",https://images.gr-assets.com/books/1434962482l/3099787.jpg,L.J. Smith,"Night World, No. 1",l.j._smith vampirebook daughters spellbinder vampires vampire sisters darkness book secret vampirebook
william_faulkner,"absalom,_absalom!",https://images.gr-assets.com/books/1388474680l/373755.jpg,William Faulkner,"Absalom, Absalom!",william_faulkner faulkner masterpiece william faulkner faulkner novels story 1936 absalom
kate_morton,the_forgotten_garden,https://images.gr-assets.com/books/1455283767l/3407877.jpg,Kate Morton,The Forgotten Garden,kate_morton intriguing fairytales cassandra life fairytales written grandmother nell cassandra lost
jean-paul_sartre lloyd_alexander hayden_carruth,nausea,https://images.gr-assets.com/books/1377674928l/298275.jpg,Jean-Paul Sartre|Lloyd Alexander|Hayden Carruth,Nausea,jean-paul_sartre lloyd_alexander hayden_carruth themes existentialist nausea story nausea hayden feeling nausea antoine roquentin
irving_stone שמואל_שניצר,the_agony_and_the_ecstasy,https://images.gr-assets.com/books/1327879079l/321552.jpg,Irving Stone|שמואל שניצר,The Agony and the Ecstasy,irving_stone שמואל_שניצר anniversary michelangelo portrait michelangelo michelangelo dangerous michelangelo david biographical novel
robert_frost edward_connery_lathem,"the_poetry_of_robert_frost_(collected_poems,_complete_&_unabridged)",https://images.gr-assets.com/books/1388204422l/95819.jpg,Robert Frost|Edward Connery Lathem,"The Poetry of Robert Frost (Collected Poems, Complete & Unabridged)",robert_frost edward_connery_lathem poems collection published poetry frost published poetry affordable poems
jorge_luis_borges anthony_kerrigan anthony_bonner,ficciones,https://images.gr-assets.com/books/1388197956l/426504.jpg,Jorge Luis Borges|Anthony Kerrigan|Anthony Bonner,Ficciones,jorge_luis_borges anthony_kerrigan anthony_bonner fantasy borges borges genius labyrinth books whirlwind borges borges
nicholas_sparks,the_lucky_one,https://images.gr-assets.com/books/1420816338l/3063499.jpg,Nicholas Sparks,The Lucky One,nicholas_sparks thibault photo photograph lucky fortune photograph logan thibault thibault finds
catherine_marshall,christy,https://images.gr-assets.com/books/1389406901l/229123.jpg,Catherine Marshall,Christy,catherine_marshall teacher christy christy struggles christy huddleston christy christy determination
lauren_oliver,pandemonium,https://images.gr-assets.com/books/1310371414l/9593911.jpg,Lauren Oliver,Pandemonium,lauren_oliver lena dead old lena lena dangerous bestseller delirium lena
dale_carnegie,how_to_win_friends_and_influence_people,https://images.gr-assets.com/books/1442726934l/4865.jpg,Dale Carnegie,How to Win Friends and Influence People,dale_carnegie influence people win friends change people friends influence make work
terry_pratchett,the_color_of_magic,https://images.gr-assets.com/books/1407111017l/34497.jpg,Terry Pratchett,The Color of Magic,terry_pratchett terry pratchett pratchett profoundly novels land discworld voyage legendary
tom_clancy,the_hunt_for_red_october,https://images.gr-assets.com/books/1281995542l/19691.jpg,Tom Clancy,The Hunt for Red October,tom_clancy tom clancy red october clancy phenomenal military thriller clancy
helene_hanff,"84,_charing_cross_road",https://images.gr-assets.com/books/1287338794l/368916.jpg,Helene Hanff,"84, Charing Cross Road",helene_hanff books relationship love story love books published 1970 correspondence helene
andrew_davidson,the_gargoyle,https://images.gr-assets.com/books/1368598513l/2595138.jpg,Andrew Davidson,The Gargoyle,andrew_davidson gargoyles marianne narrator gargoyle gargoyle inferno novel love sculptress gargoyles
nicholas_sparks,the_wedding,https://images.gr-assets.com/books/1385738787l/3466.jpg,Nicholas Sparks,The Wedding,nicholas_sparks marriage wilson notebook wedding love affair guide wilson wilson struggles
irvine_welsh,trainspotting,https://images.gr-assets.com/books/1353033083l/135836.jpg,Irvine Welsh,Trainspotting,irvine_welsh life choose choose life danny boyle filmchoose choose inspiration danny
katherine_dunn,geek_love,https://images.gr-assets.com/books/1366699063l/13872.jpg,Katherine Dunn,Geek Love,katherine_dunn geek love story binewskis geek rivalry geek obscene family
justin_cronin,the_passage,https://images.gr-assets.com/books/1327874267l/6690798.jpg,Justin Cronin,The Passage,justin_cronin story amy tale catastrophe catastrophe survival collapse amy amy abandoned
mark_twain,a_connecticut_yankee_in_king_arthur's_court,https://images.gr-assets.com/books/1348239402l/162898.jpg,Mark Twain,A Connecticut Yankee in King Arthur's Court,mark_twain enduring literature nineteenth century literature illuminated scholarship nineteenth literature
robert_james_waller,the_bridges_of_madison_county,https://images.gr-assets.com/books/1344267141l/83674.jpg,Robert James Waller,The Bridges of Madison County,robert_james_waller robert kincaid kincaid photographer kincaid story robert bridges madison
stephen_r._covey,the_7_habits_of_highly_effective_people:_powerful_lessons_in_personal_change,https://images.gr-assets.com/books/1421842784l/36072.jpg,Stephen R. Covey,The 7 Habits of Highly Effective People: Powerful Lessons in Personal Change,stephen_r._covey covey book book model book use read book book book
stieg_larsson reg_keeland,the_millennium_trilogy,https://images.gr-assets.com/books/1275608877l/7822895.jpg,Stieg Larsson|Reg Keeland,The Millennium Trilogy,stieg_larsson reg_keeland stieg larsson larsson millennium larsson best larsson larsson clearly
j.r._ward,lover_mine,https://images.gr-assets.com/books/1391511285l/7046495.jpg,J.R. Ward,Lover Mine,j.r._ward brother darius john matthew matthew matthew come darius
richard_llewellyn,how_green_was_my_valley,https://images.gr-assets.com/books/1440708862l/40496.jpg,Richard Llewellyn,How Green Was My Valley,richard_llewellyn novel green green valley born welsh welsh valley 1939
david_wroblewski,the_story_of_edgar_sawtelle,https://images.gr-assets.com/books/1310466361l/2731276.jpg,David Wroblewski,The Story of Edgar Sawtelle,david_wroblewski edgar sawtelle bewildered edgar farm edgar sawtelle dogs claude edgar
jung_chang,wild_swans:_three_daughters_of_china,https://images.gr-assets.com/books/1440643710l/1848.jpg,Jung Chang,Wild Swans: Three Daughters of China,jung_chang story generations jung chang revolution chang story generation chang describes
jeanne_duprau,the_city_of_ember,https://images.gr-assets.com/books/1397931596l/307791.jpg,Jeanne DuPrau,The City of Ember,jeanne_duprau ember decipher city ember people ember soon ember ember listen
charlaine_harris,dead_as_a_doornail,https://images.gr-assets.com/books/1468562419l/170210.jpg,Charlaine Harris,Dead as a Doornail,charlaine_harris waitress sookie sookie sookie sees shooter sookie sookie stackhouse
stephen_king,on_writing:_a_memoir_of_the_craft,https://images.gr-assets.com/books/1436735207l/10569.jpg,Stephen King,On Writing: A Memoir of the Craft,stephen_king writer king king writing stephen king publication stephen live king
karen_marie_moning,faefever,https://images.gr-assets.com/books/1437781062l/2702704.jpg,Karen Marie Moning,Faefever,karen_marie_moning author darkfever book dark dark book dublin fae fae
mildred_d._taylor,"roll_of_thunder,_hear_my_cry",https://images.gr-assets.com/books/1388345167l/310459.jpg,Mildred D. Taylor,"Roll of Thunder, Hear My Cry",mildred_d._taylor cassie family important cassie humiliates cassie logan family black cassie
s.c._stephens,thoughtless,https://images.gr-assets.com/books/1331254339l/13517535.jpg,S.C. Stephens,Thoughtless,s.c._stephens kiera boyfriend kellan kyle kellan boyfriend denny lives denny
billie_letts,where_the_heart_is,https://images.gr-assets.com/books/1327959469l/5168.jpg,Billie Letts,Where the Heart Is,billie_letts unlucky sevens old seven loves novalee novalee discover pregnant novalee
charlaine_harris,all_together_dead,https://images.gr-assets.com/books/1417964062l/140075.jpg,Charlaine Harris,All Together Dead,charlaine_harris orleans vamps vampire summit vampire novels situation vampire vampire queen
