book_authors,book_title,image_url,book_authors_init,book_title_init,keywords
p.c._cast kristin_cast,chosen,https://images.gr-assets.com/books/1393192825l/1326258.jpg,P.C. Cast|Kristin Cast,Chosen,p.c._cast kristin_cast vampyres zoey night zoey zoey friends living vampyres zoey finds
stephen_king,11/22/1963,https://images.gr-assets.com/books/1327876792l/10644930.jpg,Stephen King,11/22/1963,stephen_king jake reads life turn life turns jake mission light jake
james_joyce jeri_johnson,dubliners,https://images.gr-assets.com/books/1334138184l/11012.jpg,James Joyce|Jeri Johnson,Dubliners,james_joyce jeri_johnson life ireland ordinary dubliners reveals irish dubliners collectively ireland turn
upton_sinclair earl_lee kathleen_degrave,the_jungle,https://images.gr-assets.com/books/1332140681l/41681.jpg,Upton Sinclair|Earl Lee|Kathleen DeGrave,The Jungle,upton_sinclair earl_lee kathleen_degrave upton sinclair sinclair classic version upton edition 1905 sinclair
david_sedaris,me_talk_pretty_one_day,https://images.gr-assets.com/books/1431013639l/4137.jpg,David Sedaris,Me Talk Pretty One Day,david_sedaris david sedaris rooster portrait sedaris paris kill rooster sedaris
c.s._lewis pauline_baynes,the_voyage_of_the_dawn_treader,https://images.gr-assets.com/books/1343185059l/140225.jpg,C.S. Lewis|Pauline Baynes,The Voyage of the Dawn Treader,c.s._lewis pauline_baynes narnia companions narnia voyage king narnia lords narnia lucy edmund
jonathan_safran_foer,everything_is_illuminated,https://images.gr-assets.com/books/1479774440l/256566.jpg,Jonathan Safran Foer,Everything Is Illuminated,jonathan_safran_foer alex translator arrives ukraine grandfather nazis translator uncanny photograph searching
david_guterson,snow_falling_on_cedars,https://images.gr-assets.com/books/1479863528l/77142.jpg,David Guterson,Snow Falling on Cedars,david_guterson gripping tragic cedars masterpiece suspense leaves falling cedars masterpiece suspense
virginia_woolf,to_the_lighthouse,https://images.gr-assets.com/books/1346239665l/59716.jpg,Virginia Woolf,To the Lighthouse,virginia_woolf mrs ramsay ramsay tragic lives ramsays mr ramsay ramsay children
stephenie_meyer,the_twilight_collection,https://images.gr-assets.com/books/1388187657l/690926.jpg,Stephenie Meyer,The Twilight Collection,stephenie_meyer vampire love suspenseful twilight twilight new bestselling vampire twilight
robert_graves,"i,_claudius",https://images.gr-assets.com/books/1388185810l/18765.jpg,Robert Graves,"I, Claudius",robert_graves emperor claudius autobiography tiberius tiberius claudius claudius born roman emperor
e.m._forster,a_room_with_a_view,https://images.gr-assets.com/books/1388781285l/3087.jpg,E.M. Forster,A Room with a View,e.m._forster contradiction love lucy finds expresses lucy lucy rigid flamboyant romantic
rick_riordan,the_house_of_hades,https://images.gr-assets.com/books/1464201430l/12127810.jpg,Rick Riordan,The House of Hades,rick_riordan annabeth percy percy overwhelmed hades able percy exactly hades
maya_angelou,i_know_why_the_caged_bird_sings,https://images.gr-assets.com/books/1327957927l/13214.jpg,Maya Angelou,I Know Why the Caged Bird Sings,maya_angelou maya brother maya maya learns town maya maya attacked
george_r.r._martin,a_dance_with_dragons,https://images.gr-assets.com/books/1327885335l/10664113.jpg,George R.R. Martin,A Dance with Dragons,george_r.r._martin daenerys targaryen daenerys daenerys claim way daenerys death daenerys
isaac_asimov,"i,_robot",https://images.gr-assets.com/books/1388321463l/41804.jpg,Isaac Asimov,"I, Robot",isaac_asimov robot asimov laws robotics robot obey robots forever robots robots
stephen_king,carrie,https://images.gr-assets.com/books/1166254258l/10592.jpg,Stephen King,Carrie,stephen_king carrie scorned carrie carrie knew prom carrie scorned humiliated
william_shakespeare rex_gibson richard_andrews,hamlet,https://images.gr-assets.com/books/1351051208l/1420.jpg,William Shakespeare|Rex Gibson|Richard Andrews,Hamlet,william_shakespeare rex_gibson richard_andrews plays hamlet shakespeare plays role hamlet hamlet considered hamlet prince
c.s._lewis,the_last_battle,https://images.gr-assets.com/books/1308814830l/84369.jpg,C.S. Lewis,The Last Battle,c.s._lewis edition lewis forthcoming narnia narnia lewis classic narnia feature
richelle_mead,bloodlines,https://images.gr-assets.com/books/1297199431l/8709527.jpg,Richelle Mead,Bloodlines,richelle_mead jill sydney sydney vampires sydney blood encounter sydney jill guardian
julie_kagawa,the_iron_king,https://images.gr-assets.com/books/1327877670l/6644117.jpg,Julie Kagawa,The Iron King,julie_kagawa meghan chase meghan life meghan senses protective meghan meghan learn
charles_dickens nicola_bradbury hablot_knight_browne,bleak_house,https://images.gr-assets.com/books/1280113147l/31242.jpg,Charles Dickens|Nicola Bradbury|Hablot Knight Browne,Bleak House,charles_dickens nicola_bradbury hablot_knight_browne dickens published dickens charles dickens dickens finest dickens portrait
william_peter_blatty,the_exorcist,https://images.gr-assets.com/books/1375168676l/179780.jpg,William Peter Blatty,The Exorcist,william_peter_blatty terrifying novel novel written faith demonic demonic possession peter blatty
kiera_cass,the_one,https://images.gr-assets.com/books/1395612906l/18635016.jpg,Kiera Cass,The One,kiera_cass winner crowned crowned chosen crowned crown prince chosen compete
diana_gabaldon diana_gabaldon,voyager,https://images.gr-assets.com/books/1483278195l/10987.jpg,Diana Gabaldon|Diana Gabaldon,Voyager,diana_gabaldon diana_gabaldon outlander dragonfly bestsellers outlander claire discovers discovers jamie dreams claire
lauren_kate,torment,https://images.gr-assets.com/books/1362339749l/7740152.jpg,Lauren Kate,Torment,lauren_kate lives luce luce discovers luce really luce learns happened luce
evelyn_waugh,brideshead_revisited:_the_sacred_and_profane_memories_of_captain_charles_ryder,https://images.gr-assets.com/books/1438579340l/30933.jpg,Evelyn Waugh,Brideshead Revisited: The Sacred and Profane Memories of Captain Charles Ryder,evelyn_waugh novels brideshead brideshead revisited waugh novels evelyn waugh brideshead
william_makepeace_thackeray john_carey,vanity_fair,https://images.gr-assets.com/books/1344386439l/5797.jpg,William Makepeace Thackeray|John Carey,Vanity Fair,william_makepeace_thackeray john_carey amelia sedley sharp orphan becky sharp victorian heroine novel
richard_dawkins,the_god_delusion,https://images.gr-assets.com/books/1347220693l/14743.jpg,Richard Dawkins,The God Delusion,richard_dawkins prominent atheist atheism atheism individual atheist asserts advantages atheism
plato desmond_lee,the_republic,https://images.gr-assets.com/books/1386925655l/30289.jpg,Plato|Desmond Lee,The Republic,plato desmond_lee dialogue socrates allegory plato plato socrates knowledge republic
dalton_trumbo,johnny_got_his_gun,https://images.gr-assets.com/books/1386925458l/51606.jpg,Dalton Trumbo,Johnny Got His Gun,dalton_trumbo ordinary war ordinary novel gruesome war novel novel novel
emily_dickinson thomas_h._johnson,the_complete_poems_of_emily_dickinson,https://images.gr-assets.com/books/1498347611l/112204.jpg,Emily Dickinson|Thomas H. Johnson,The Complete Poems of Emily Dickinson,emily_dickinson thomas_h._johnson poems emily dickinson poems poems published dickinson poemsonly dickinson wrote
cassandra_clare,the_mortal_instruments_boxed_set:_city_of_bones;_city_of_ashes;_city_of_glass,https://images.gr-assets.com/books/1312016549l/6485421.jpg,Cassandra Clare,The Mortal Instruments Boxed Set: City of Bones; City of Ashes; City of Glass,cassandra_clare clary jace jace clary clary killed disappears clary clary mother
sarah_j._maas,crown_of_midnight,https://images.gr-assets.com/books/1391580481l/17167166.jpg,Sarah J. Maas,Crown of Midnight,sarah_j._maas celaena realizes champion celaena celaena tragedy celaena difficult celaena
w._somerset_maugham benjamin_demott maeve_binchy,of_human_bondage,https://images.gr-assets.com/books/1386924695l/31548.jpg,W. Somerset Maugham|Benjamin DeMott|Maeve Binchy,Of Human Bondage,w._somerset_maugham benjamin_demott maeve_binchy autobiographical maugham maugham masterpieces carey orphan masterpieces story story philip
neal_stephenson,snow_crash,https://images.gr-assets.com/books/1477624625l/830.jpg,Neal Stephenson,Snow Crash,neal_stephenson hiro protagonist reality hiro pizza metaverse hiro virtual villain
greg_mortenson david_oliver_relin,three_cups_of_tea:_one_man's_mission_to_promote_peace_..._one_school_at_a_time,https://images.gr-assets.com/books/1395407074l/49436.jpg,Greg Mortenson|David Oliver Relin,Three Cups of Tea: One Man's Mission to Promote Peace ... One School at a Time,greg_mortenson david_oliver_relin mortenson claim questioned mortenson mortenson accounts cbs documentary cai funds
libba_bray,a_great_and_terrible_beauty,https://images.gr-assets.com/books/1284558475l/3682.jpg,Libba Bray,A Great and Terrible Beauty,libba_bray gemma doyle gemma old gemma gemma classmates gothic novel
elizabeth_gaskell alan_shelston,north_and_south,https://images.gr-assets.com/books/1349633381l/156538.jpg,Elizabeth Gaskell|Alan Shelston,North and South,elizabeth_gaskell alan_shelston victorian literature milton margaret heroines victorian margaret hale concern margaret
anne_rice,the_witching_hour,https://images.gr-assets.com/books/1327289387l/11901.jpg,Anne Rice,The Witching Hour,anne_rice novel witchcraft witchcraft occult witches family witches witchcraft
sylvia_day,bared_to_you,https://images.gr-assets.com/books/1433411511l/20448515.jpg,Sylvia Day,Bared to You,sylvia_day phenomenon gideon gideon cross gideon author sylvia gideon knew
simone_elkeles,perfect_chemistry,https://images.gr-assets.com/books/1439792475l/4268157.jpg,Simone Elkeles,Perfect Chemistry,simone_elkeles realizes brittany brittany alex lovers brittany brittany ellis brittany real
jeaniene_frost,halfway_to_the_grave,https://images.gr-assets.com/books/1373855613l/1421990.jpg,Jeaniene Frost,Halfway to the Grave,jeaniene_frost bones vampire vampire catherine vampire bounty half vampire catherine crawfield
terry_goodkind,wizard's_first_rule,https://images.gr-assets.com/books/1385248539l/43889.jpg,Terry Goodkind,Wizard's First Rule,terry_goodkind birth legend sword truth beginning book betray richard epic sword
stephenie_meyer,the_host,https://images.gr-assets.com/books/1318009171l/1656001.jpg,Stephenie Meyer,The Host,stephenie_meyer wanderer melanie ace melanie melanie stryder mind melanie wanderer thoughts
alan_paton,"cry,_the_beloved_country",https://images.gr-assets.com/books/1344182368l/6150.jpg,Alan Paton,"Cry, the Beloved Country",alan_paton novels poets beloved country novel black poet novelist important novel
joanne_harris,chocolat,https://images.gr-assets.com/books/1388674628l/47401.jpg,Joanne Harris,Chocolat,joanne_harris chocolat timeless description chocolate exquisite chocolate chocolat page realism chocolat
max_brooks,world_war_z:_an_oral_history_of_the_zombie_war,https://images.gr-assets.com/books/1528312647l/8908.jpg,Max Brooks,World War Z: An Oral History of the Zombie War,max_brooks zombie war zombie duration zombie living undead undead hell
rick_yancey,the_5th_wave,https://images.gr-assets.com/books/1359853842l/16101128.jpg,Rick Yancey,The 5th Wave,rick_yancey saving cassie 5th wave highway cassie cassie choose cassie believes
kelley_armstrong,the_summoning,https://images.gr-assets.com/books/1478986944l/2800905.jpg,Kelley Armstrong,The Summoning,kelley_armstrong lyle house housemates meets housemates think housemates secrets lyle
p.d._eastman merwin_goldsmith marian_hailey ron_marshall brendon_parry jim_thurman ray_messecar chris_campbell ron_nicodemus sharon_lerner phil_eastman,are_you_my_mother?,https://images.gr-assets.com/books/1389098758l/197084.jpg,P.D. Eastman|Merwin Goldsmith|MARIAN HAILEY|Ron Marshall|Brendon Parry|Jim Thurman|Ray Messecar|Chris Campbell|Ron Nicodemus|Sharon Lerner|Phil Eastman,Are You My Mother?,p.d._eastman merwin_goldsmith marian_hailey ron_marshall brendon_parry jim_thurman ray_messecar chris_campbell ron_nicodemus sharon_lerner phil_eastman books geisel books series popular books beginner books books
john_steinbeck,cannery_row,https://images.gr-assets.com/books/1388188936l/4799.jpg,John Steinbeck,Cannery Row,john_steinbeck story cannery cannery row place cannery cannery sequel cannery
wilkie_collins matthew_sweet,the_woman_in_white,https://images.gr-assets.com/books/1295661017l/5890.jpg,Wilkie Collins|Matthew Sweet,The Woman in White,wilkie_collins matthew_sweet victorian genre victorian sensation phenomenon victorian influential victorian victorian
h.g._wells arthur_c._clarke,the_war_of_the_worlds,https://images.gr-assets.com/books/1320391644l/8909.jpg,H.G. Wells|Arthur C. Clarke,The War of the Worlds,h.g._wells arthur_c._clarke story martian martian attack danger martians martians martians spite
max_lucado,"you_are_special_(wemmicksville,_#1)",https://images.gr-assets.com/books/1348346102l/56728.jpg,Max Lucado,"You Are Special (Wemmicksville, #1)",max_lucado wemmicksville punchinello life wemmicksville god wemmicksville wemmicksville uniquely wemmicksville heartwarming
chris_van_allsburg liam_neeson,the_polar_express,https://images.gr-assets.com/books/1356707942l/420282.jpg,Chris Van Allsburg|Liam Neeson,The Polar Express,chris_van_allsburg liam_neeson polar express 1986 polar holiday movie treasured holiday polar
daniel_quinn,ishmael:_an_adventure_of_the_mind_and_spirit,https://images.gr-assets.com/books/1388180479l/227265.jpg,Daniel Quinn,Ishmael: An Adventure of the Mind and Spirit,daniel_quinn adventure published edition hereteacher begins ishmael adventure lifetime hereteacher seeks
sarah_dessen,just_listen,https://images.gr-assets.com/books/1358270741l/51738.jpg,Sarah Dessen,Just Listen,sarah_dessen annabel girl maybe annabel annabel year annabel sophie
michelle_hodkin,the_unbecoming_of_mara_dyer,https://images.gr-assets.com/books/1336655755l/11408650.jpg,Michelle Hodkin,The Unbecoming of Mara Dyer,michelle_hodkin mara dyer dyer believes believes accident life stranger dyer
william_shakespeare barbara_a._mowat paul_werstine gail_kern_paster robert__________jackson,much_ado_about_nothing,https://images.gr-assets.com/books/1327885569l/12957.jpg,William Shakespeare|Barbara A. Mowat|Paul Werstine|Gail Kern Paster|Robert          Jackson,Much Ado About Nothing,william_shakespeare barbara_a._mowat paul_werstine gail_kern_paster robert__________jackson discusses shakespeare shakespeare enjoyable shakespeare ado shakespeare shakespeare transformation
sherrilyn_kenyon,acheron,https://images.gr-assets.com/books/1437687512l/2299110.jpg,Sherrilyn Kenyon,Acheron,sherrilyn_kenyon human acheron thousand years defender mankind god born acheron
becca_fitzpatrick,silence,https://images.gr-assets.com/books/1362408152l/10637766.jpg,Becca Fitzpatrick,Silence,becca_fitzpatrick missing nora nora grey heard nora nora nora crosses
neal_shusterman,unwind,https://images.gr-assets.com/books/1297677706l/764347.jpg,Neal Shusterman,Unwind,neal_shusterman connor risa risa lev end connor reproductive rights alive lev
tatiana_de_rosnay,sarah's_key,https://images.gr-assets.com/books/1438863728l/556602.jpg,Tatiana de Rosnay,Sarah's Key,tatiana_de_rosnay tatiana rosnay journalist julia episode paris sarah julia tatiana
tennessee_williams,the_glass_menagerie,https://images.gr-assets.com/books/1391591003l/92517.jpg,Tennessee Williams,The Glass Menagerie,tennessee_williams story mother dream world shattered jagged cling dream daughter suitor
charlaine_harris,dead_to_the_world,https://images.gr-assets.com/books/1468561630l/140077.jpg,Charlaine Harris,Dead to the World,charlaine_harris clue sookie sookie eric sookie stackhouse sookie guy sookie
d.h._lawrence,lady_chatterley's_lover,https://images.gr-assets.com/books/1215571713l/32049.jpg,D.H. Lawrence,Lady Chatterley's Lover,d.h._lawrence pornography 1960 portrayal extramarital banned pornography frank portrayal lawrence frank
sarah_dessen,the_truth_about_forever,https://images.gr-assets.com/books/1362767907l/51737.jpg,Sarah Dessen,The Truth About Forever,sarah_dessen summer macy loss macy upside macy cover editions editions isbn
p.c._cast kristin_cast,hunted,https://images.gr-assets.com/books/1438042897l/4134071.jpg,P.C. Cast|Kristin Cast,Hunted,p.c._cast kristin_cast zoey secrets series zoey shows zoey zoey friends zoey
pittacus_lore,i_am_number_four,https://images.gr-assets.com/books/1305807140l/7747374.jpg,Pittacus Lore,I Am Number Four,pittacus_lore superheroes worship seen superheroes superheroes powers dream doing powers
jon_krakauer,into_thin_air:_a_personal_account_of_the_mount_everest_disaster,https://images.gr-assets.com/books/1463384482l/1898.jpg,Jon Krakauer,Into Thin Air: A Personal Account of the Mount Everest Disaster,jon_krakauer krakauer guilt krakauer epic jon krakauer air krakauer krakauer
leo_tolstoy henry_gifford aylmer_maude louise_maude,war_and_peace,https://images.gr-assets.com/books/1413215930l/656.jpg,Leo Tolstoy|Henry Gifford|Aylmer Maude|Louise Maude,War and Peace,leo_tolstoy henry_gifford aylmer_maude louise_maude translation tolstoy tolstoy masterwork tolstoy invades tolstoy tolstoy brilliantly
j.d._salinger,nine_stories,https://images.gr-assets.com/books/1514839407l/4009.jpg,J.D. Salinger,Nine Stories,j.d._salinger salinger published short stories stories title stories 1953 stories perfect
randy_pausch jeffrey_zaslow,the_last_lecture,https://images.gr-assets.com/books/1388075896l/2318271.jpg,Randy Pausch|Jeffrey Zaslow,The Last Lecture,randy_pausch jeffrey_zaslow randy pausch discovered pancreatic pancreatic cancer pancreatic professor randy
anonymous richard_francis_burton a.s._byatt,the_arabian_nights,https://images.gr-assets.com/books/1388212809l/93101.jpg,Anonymous|Richard Francis Burton|A.S. Byatt,The Arabian Nights,anonymous richard_francis_burton a.s._byatt adventures aladdin tales tales told stories depict tales anchored
paullina_simons,the_bronze_horseman,https://images.gr-assets.com/books/1327921996l/83144.jpg,Paullina Simons,The Bronze Horseman,paullina_simons life leningrad tatiana love bleak tatiana 1941 metanov leningrad german
martin_heidegger,being_and_time,https://images.gr-assets.com/books/1298438455l/92307.jpg,Martin Heidegger,Being and Time,martin_heidegger philosophical works philosophy literature important philosophical philosophy literature psychology
dodie_smith,i_capture_the_castle,https://images.gr-assets.com/books/1385316083l/31122.jpg,Dodie Smith,I Capture the Castle,dodie_smith cassandra mortmain household cassandra old cassandra cassandra deeply cassandra
william_shakespeare,twelfth_night,https://images.gr-assets.com/books/1416628008l/1625.jpg,William Shakespeare,Twelfth Night,william_shakespeare romantic plot merrymakers wishes laughter clown comedy devises revel comedy
neil_gaiman,coraline,https://images.gr-assets.com/books/1493497435l/17061.jpg,Neil Gaiman,Coraline,neil_gaiman coraline unlocks mirrors coraline exploring coraline coraline family novel ages
sarah_j._maas,heir_of_fire,https://images.gr-assets.com/books/1460846511l/20613470.jpg,Sarah J. Maas,Heir of Fire,sarah_j._maas world celaena celaena celaena strength celaena survived sequel new
marcel_proust simon_vance lydia_davis,swann's_way,https://images.gr-assets.com/books/1452956236l/12749.jpg,Marcel Proust|Simon Vance|Lydia Davis,Swann's Way,marcel_proust simon_vance lydia_davis night marcel swann way stays swann marcel room swann leaves
stephen_king,pet_sematary,https://images.gr-assets.com/books/1308894674l/10583.jpg,Stephen King,Pet Sematary,stephen_king dead better death hideously terrifying death better creeds death
susan_ee,angelfall,https://images.gr-assets.com/books/1464206558l/15863832.jpg,Susan Ee,Angelfall,susan_ee angels apocalypse enemy angel warrior angels weeks angels angel raffe
deborah_harkness,a_discovery_of_witches,https://images.gr-assets.com/books/1525097370l/8667848.jpg,Deborah Harkness,A Discovery of Witches,deborah_harkness library diana witches diana scholar diana bewitched alchemical alchemical manuscript
thomas_hardy rosemarie_morgan shannon_russell,far_from_the_madding_crowd,https://images.gr-assets.com/books/1388279695l/31463.jpg,Thomas Hardy|Rosemarie Morgan|Shannon Russell,Far From the Madding Crowd,thomas_hardy rosemarie_morgan shannon_russell hardy novel wessex hardy farmer boldwood spirited bathsheba bathsheba everdene
melissa_marr,wicked_lovely,https://images.gr-assets.com/books/1327814035l/305234.jpg,Melissa Marr,Wicked Lovely,melissa_marr faeries aislinn invisible faeries faeries powerful faeries stalking seen faeries
barbara_kingsolver,the_bean_trees,https://images.gr-assets.com/books/1443483961l/30868.jpg,Barbara Kingsolver,The Bean Trees,barbara_kingsolver taylor greer spirited taylor greer grew greer eyed spirited
kiera_cass,the_elite,https://images.gr-assets.com/books/1391454595l/16248068.jpg,Kiera Cass,The Elite,kiera_cass prince maxon elite competition maxon heart aspen america narrowed elite
jhumpa_lahiri,interpreter_of_maladies,https://images.gr-assets.com/books/1442586143l/5439.jpg,Jhumpa Lahiri,Interpreter of Maladies,jhumpa_lahiri indian traditions jhumpa lahiri navigating indian indian american india ancestors
laura_ingalls_wilder garth_williams,little_house_on_the_prairie,https://images.gr-assets.com/books/1441903581l/77767.jpg,Laura Ingalls Wilder|Garth Williams,Little House on the Prairie,laura_ingalls_wilder garth_williams laura ingalls continue laura hunting wild adventures adventures continue
colleen_hoover,slammed,https://images.gr-assets.com/books/1328530463l/13372690.jpg,Colleen Hoover,Slammed,colleen_hoover old layken layken introduction layken rock mother mother younger
anthony_doerr,all_the_light_we_cannot_see,https://images.gr-assets.com/books/1451445646l/18143977.jpg,Anthony Doerr,All the Light We Cannot See,anthony_doerr laure werner marie laure imagined werner werner werner expert
cecelia_ahern,p.s._i_love_you,https://images.gr-assets.com/books/1392344536l/366522.jpg,Cecelia Ahern,P.S. I Love You,cecelia_ahern love letter endearing novel love paperback captivating love old holly
c.s._lewis,the_horse_and_his_boy,https://images.gr-assets.com/books/1388210968l/84119.jpg,C.S. Lewis,The Horse and His Boy,c.s._lewis horse boy horse narnia race talking horse land narnia
rick_riordan,the_red_pyramid,https://images.gr-assets.com/books/1366227978l/7090447.jpg,Rick Riordan,The Red Pyramid,rick_riordan carter sadie carter reunited sadie carter carter just life carter
edmond_rostand eteel_lawson lowell_bair,cyrano_de_bergerac,https://images.gr-assets.com/books/1386920459l/15638.jpg,Edmond Rostand|Eteel Lawson|Lowell Bair,Cyrano de Bergerac,edmond_rostand eteel_lawson lowell_bair immortal play plays literature rostand immortal play chivalry edmond rostand
arthur_c._clarke,2001:_a_space_odyssey,https://images.gr-assets.com/books/1432468943l/70535.jpg,Arthur C. Clarke,2001: A Space Odyssey,arthur_c._clarke moon enigma moon enigma uncovered fiction novels enigma
john_steinbeck,the_grapes_of_wrath,https://images.gr-assets.com/books/1513108059l/18114322.jpg,John Steinbeck,The Grapes of Wrath,john_steinbeck steinbeck pulitzer gospel steinbeck 1939 steinbeck steinbeck steinbeck powerful
diana_gabaldon,drums_of_autumn,https://images.gr-assets.com/books/1500688941l/10988.jpg,Diana Gabaldon,Drums of Autumn,diana_gabaldon daughter brianna story claire lives brianna novel outlander brianna
laura_ingalls_wilder garth_williams,little_house_in_the_big_woods,https://images.gr-assets.com/books/1475195170l/8337.jpg,Laura Ingalls Wilder|Garth Williams,Little House in the Big Woods,laura_ingalls_wilder garth_williams laura ingalls laura sister neighbors bears woods wisconsin laura
ken_follett,world_without_end,https://images.gr-assets.com/books/1509545511l/5064.jpg,Ken Follett,World Without End,ken_follett world end earth cathedral cathedral priory gothic cathedral cathedral
garth_nix,sabriel,https://images.gr-assets.com/books/1293655399l/518848.jpg,Garth Nix,Sabriel,garth_nix kingdom sabriel abhorsen series father abhorsen magic dead abhorsen
alexandra_bracken,the_darkest_minds,https://images.gr-assets.com/books/1343178841l/10576365.jpg,Alexandra Bracken,The Darkest Minds,alexandra_bracken ruby dangerous ruby risk government ruby sixteen ruby ruby faced
peter_s._beagle,the_last_unicorn,https://images.gr-assets.com/books/1524764327l/29127.jpg,Peter S. Beagle,The Last Unicorn,peter_s._beagle unicorn lived stalk unicorn unicorn ignore unicorns completely unicorn
sarah_j._maas,a_court_of_thorns_and_roses,https://images.gr-assets.com/books/1491595796l/16096824.jpg,Sarah J. Maas,A Court of Thorns and Roses,sarah_j._maas faerie feyre feyre survival feyre fight place feyre feyre presence
abraham_verghese,cutting_for_stone,https://images.gr-assets.com/books/1327931601l/3591262.jpg,Abraham Verghese,Cutting for Stone,abraham_verghese marion shiva medicine twins twin brothers story power ababa orphaned
shannon_hale,the_goose_girl,https://images.gr-assets.com/books/1330728389l/179064.jpg,Shannon Hale,The Goose Girl,shannon_hale princess kildenree tale princess anidora kiladra kiladra talianna grimm fairy
tahereh_mafi,ignite_me,https://images.gr-assets.com/books/1375972497l/13188676.jpg,Tahereh Mafi,Ignite Me,tahereh_mafi novels novels tantalizing adult novels bestselling author final book
robert_penn_warren,all_the_king's_men,https://images.gr-assets.com/books/1342193852l/5527.jpg,Robert Penn Warren,All the King's Men,robert_penn_warren novel warren warren tale politics warren warren stark warren
william_shakespeare roma_gill فرنگیس_شادمان,julius_caesar,https://images.gr-assets.com/books/1354574927l/13006.jpg,William Shakespeare|Roma Gill|فرنگیس شادمان,Julius Caesar,william_shakespeare roma_gill فرنگیس_شادمان list shakespeare shakespeare plays shakespeare sources new shakespeare shakespeare
