book_authors,book_title,image_url,book_authors_init,book_title_init,keywords
maggie_stiefvater,shiver,https://images.gr-assets.com/books/1409283154l/6068551.jpg,Maggie Stiefvater,Shiver,maggie_stiefvater wolf chilling wolf winter eyed wolf wolf wolf wolf
shel_silverstein,a_light_in_the_attic,https://images.gr-assets.com/books/1427169918l/30118.jpg,Shel Silverstein,A Light in the Attic,shel_silverstein book poems poems poetry collections poetry beloved poetry
corrie_ten_boom john_sherrill elizabeth_sherrill,the_hiding_place:_the_triumphant_true_story_of_corrie_ten_boom,https://images.gr-assets.com/books/1320418824l/561909.jpg,Corrie ten Boom|John Sherrill|Elizabeth Sherrill,The Hiding Place: The Triumphant True Story of Corrie Ten Boom,corrie_ten_boom john_sherrill elizabeth_sherrill corrie boom corrie death time corrie help corrie corrie
wally_lamb,she's_come_undone,https://images.gr-assets.com/books/1408113538l/5203.jpg,Wally Lamb,She's Come Undone,wally_lamb dolores price age odyssey odyssey wally dolores pounds dolores
homer robert_fagles bernard_knox,the_iliad/the_odyssey,https://images.gr-assets.com/books/1388181863l/1375.jpg,Homer|Robert Fagles|Bernard Knox,The Iliad/The Odyssey,homer robert_fagles bernard_knox epic iliad iliad story iliad years iliad odyssey literature
franz_kafka willa_muir edwin_muir max_brod,the_trial,https://images.gr-assets.com/books/1320399438l/17690.jpg,Franz Kafka|Willa Muir|Edwin Muir|Max Brod,The Trial,franz_kafka willa_muir edwin_muir max_brod 1914 published written 1914 kafka death death trial totalitarianism trial
rick_riordan,the_lost_hero,https://images.gr-assets.com/books/1464201003l/7736182.jpg,Rick Riordan,The Lost Hero,rick_riordan jason amnesia does jason jason problem jason leo jason
kenneth_grahame gillian_avery,the_wind_in_the_willows,https://images.gr-assets.com/books/1423183570l/5659.jpg,Kenneth Grahame|Gillian Avery,The Wind in the Willows,kenneth_grahame gillian_avery literature childrenmeet petulant toad willows timeless wind willows ratty badger
erin_morgenstern,the_night_circus,https://images.gr-assets.com/books/1387124618l/9361589.jpg,Erin Morgenstern,The Night Circus,erin_morgenstern circus stage extraordinary circus circus circus arrives magicians celia
arundhati_roy,the_god_of_small_things,https://images.gr-assets.com/books/1436217001l/9777.jpg,Arundhati Roy,The God of Small Things,arundhati_roy kerala kerala southernmost state kerala fraternal twins twins esthappen
c.s._lewis,the_screwtape_letters,https://images.gr-assets.com/books/1507310167l/17383917.jpg,C.S. Lewis,The Screwtape Letters,c.s._lewis literary theological screwtape letters author treasured beloved author man screwtape
john_grogan,marley_and_me:_life_and_love_with_the_world's_worst_dog,https://images.gr-assets.com/books/1308858322l/12691.jpg,John Grogan,Marley and Me: Life and Love With the World's Worst Dog,john_grogan marley heart life marley marley marley expelled boundless marley
cassandra_clare,clockwork_prince,https://images.gr-assets.com/books/1460477747l/10025305.jpg,Cassandra Clare,Clockwork Prince,cassandra_clare betrayed tessa tessa discovers jem tessa secrets tessa tessa powers
thomas___harris,the_silence_of_the_lambs,https://images.gr-assets.com/books/1390426249l/23807.jpg,Thomas   Harris,The Silence of the Lambs,thomas___harris trainee investigator investigator killer loose beauty skin investigator trying
cassandra_clare,city_of_fallen_angels,https://images.gr-assets.com/books/1369452302l/6752378.jpg,Cassandra Clare,City of Fallen Angels,cassandra_clare war clary explaining clary clary old clary clary forced
scott_westerfeld,uglies,https://images.gr-assets.com/books/1443904172l/24770.jpg,Scott Westerfeld,Uglies,scott_westerfeld tally turn tally new tally tally choice tally learns
kiera_cass,the_selection,https://images.gr-assets.com/books/1322103400l/10507293.jpg,Kiera Cass,The Selection,kiera_cass girls selection thirty girls singer selected life dreamed meets prince
gaston_leroux alexander_teixeira_de_mattos,the_phantom_of_the_opera,https://images.gr-assets.com/books/1327867727l/480204.jpg,Gaston Leroux|Alexander Teixeira de Mattos,The Phantom of the Opera,gaston_leroux alexander_teixeira_de_mattos ghost opera phantom opera paris opera opera opera house
p.c._cast kristin_cast,marked,https://images.gr-assets.com/books/1317067002l/30183.jpg,P.C. Cast|Kristin Cast,Marked,p.c._cast kristin_cast zoey redbird vampyre goddess old zoey zoey gifts zoey
gail_carson_levine,ella_enchanted,https://images.gr-assets.com/books/1410727190l/24337.jpg,Gail Carson Levine,Ella Enchanted,gail_carson_levine ella enchanted fairy tales lucinda curse cinderella roles fairy
haruki_murakami jay_rubin,the_wind-up_bird_chronicle,https://images.gr-assets.com/books/1327872639l/11275.jpg,Haruki Murakami|Jay Rubin,The Wind-Up Bird Chronicle,haruki_murakami jay_rubin international fiction bird chronicle regarded novelist imaginative novel prophet birdcatcher
viktor_e._frankl harold_s._kushner william_j._winslade isle_lasch,man's_search_for_meaning,https://images.gr-assets.com/books/1535419394l/4069.jpg,Viktor E. Frankl|Harold S. Kushner|William J. Winslade|Isle Lasch,Man's Search for Meaning,viktor_e._frankl harold_s._kushner william_j._winslade isle_lasch frankl memoir logotherapy logotherapy conviction known logotherapy viktor frankl
william_faulkner,the_sound_and_the_fury,https://images.gr-assets.com/books/1433089995l/10975.jpg,William Faulkner,The Sound and the Fury,william_faulkner faulkner wrote excerpts faulkner versions faulkner memoir faulkner faulkner interviews
william_paul_young,the_shack,https://images.gr-assets.com/books/1344270232l/1812457.jpg,William Paul Young,The Shack,william_paul_young sadness mack mack world missy abducted mackenzie change mack
hunter_s._thompson ralph_steadman,fear_and_loathing_in_las_vegas,https://images.gr-assets.com/books/1394204569l/7745.jpg,Hunter S. Thompson|Ralph Steadman,Fear and Loathing in Las Vegas,hunter_s._thompson ralph_steadman fear loathing loathing las vegas best fear vegas
josé_saramago giovanni_pontiero,blindness,https://images.gr-assets.com/books/1327866409l/2526.jpg,José Saramago|Giovanni Pontiero,Blindness,josé_saramago giovanni_pontiero harrowing blindness story plague eyewitness nightmare blindness reclaims blindness
stephenie_meyer,midnight_sun,,Stephenie Meyer,Midnight Sun,stephenie_meyer retelling twilight twilight twilight edward midnight sun cullen perspective
alex_haley,roots:_the_saga_of_an_american_family,https://images.gr-assets.com/books/1329398936l/546018.jpg,Alex Haley,Roots: The Saga of an American Family,alex_haley abducted 1767 africa abducted genealogical detective haley recapture haley grandmother
george_r.r._martin,a_clash_of_kings,https://images.gr-assets.com/books/1358254974l/10572.jpg,George R.R. Martin,A Clash of Kings,george_r.r._martin thrones storm game thrones thrones throne seven modern fantasy
bill_watterson,the_complete_calvin_and_hobbes,https://images.gr-assets.com/books/1473064526l/24812.jpg,Bill Watterson,The Complete Calvin and Hobbes,bill_watterson calvin hobbes hobbes cartoons hobbes composed comic strips cartoons published
robert_a._heinlein,stranger_in_a_strange_land,https://images.gr-assets.com/books/1156897088l/350.jpg,Robert A. Heinlein,Stranger in a Strange Land,robert_a._heinlein marsvalentine michael michael smithancestry michael smith valentine michael smith human
scott_o'dell,island_of_the_blue_dolphins,https://images.gr-assets.com/books/1475166260l/233818.jpg,Scott O'Dell,Island of the Blue Dolphins,scott_o'dell sea elephants survival tale elephants sea blue dolphins story karana
sarah_j._maas,throne_of_glass,https://images.gr-assets.com/books/1495278054l/7896527.jpg,Sarah J. Maas,Throne of Glass,sarah_j._maas assassin celaena celaena finds freedom celaena celaena celaena sardothien
ernest_hemingway,for_whom_the_bell_tolls,https://images.gr-assets.com/books/1492591524l/46170.jpg,Ernest Hemingway,For Whom the Bell Tolls,ernest_hemingway hemingway reading wrote hemingway ernest hemingway hemingway hemingway surpasses
mary_ann_shaffer annie_barrows,the_guernsey_literary_and_potato_peel_pie_society,https://images.gr-assets.com/books/1351979318l/2728527.jpg,Mary Ann Shaffer|Annie Barrows,The Guernsey Literary and Potato Peel Pie Society,mary_ann_shaffer annie_barrows guernsey literary island guernsey sail guernsey guernsey come guernsey finds
suzanne_collins,catching_fire,https://images.gr-assets.com/books/1358273780l/6148028.jpg,Suzanne Collins,Catching Fire,suzanne_collins katniss peeta shock katniss rebellion katniss katniss relieved story katniss
stephen_king,the_green_mile,https://images.gr-assets.com/books/1373903563l/11566.jpg,Stephen King,The Green Mile,stephen_king green mile stephen king coffey truth king green truth coffey
isabel_allende magda_bogin,the_house_of_the_spirits,https://images.gr-assets.com/books/1358615501l/9328.jpg,Isabel Allende|Magda Bogin,The House of the Spirits,isabel_allende magda_bogin century isabel isabel isabel allende house spirits daughter blanca
lauren_oliver,delirium,https://images.gr-assets.com/books/1327890411l/11614718.jpg,Lauren Oliver,Delirium,lauren_oliver love declared treatment lena lena meets fall love cure living
stieg_larsson reg_keeland,the_girl_who_kicked_the_hornet's_nest,https://images.gr-assets.com/books/1327708260l/6892870.jpg,Stieg Larsson|Reg Keeland,The Girl Who Kicked the Hornet's Nest,stieg_larsson reg_keeland stieg larsson trilogy lisbeth lisbeth salander victim salander larsson
wally_lamb,i_know_this_much_is_true,https://images.gr-assets.com/books/1373532198l/227711.jpg,Wally Lamb,I Know This Much Is True,wally_lamb wally lamb time wally novels time brother thomas wally
janet_fitch,white_oleander,https://images.gr-assets.com/books/1501159524l/32234.jpg,Janet Fitch,White Oleander,janet_fitch story ingrid astrid odyssey daughter astrid astrid white oleander
anne_rice,the_vampire_lestat,https://images.gr-assets.com/books/1347515742l/43814.jpg,Anne Rice,The Vampire Lestat,anne_rice lestat rockstar vampire chronicles lestat vampire france lestat
jamie_mcguire,beautiful_disaster,https://images.gr-assets.com/books/1358259032l/11505797.jpg,Jamie McGuire,Beautiful Disaster,jamie_mcguire exactly abby abby abernathy abby resistance new abby abby believes
john_green,paper_towns,https://images.gr-assets.com/books/1349013610l/6442769.jpg,John Green,Paper Towns,john_green margo quentin quentin jacobsen margo enigma real margo margo roth
william_shakespeare,othello,https://images.gr-assets.com/books/1459795105l/12996.jpg,William Shakespeare,Othello,william_shakespeare othello shakespeare othello desdemona love othello desdemona othello trusting othello
christopher_moore,"lamb:_the_gospel_according_to_biff,_christ's_childhood_pal",https://images.gr-assets.com/books/1331419009l/28881.jpg,Christopher Moore,"Lamb: The Gospel According to Biff, Christ's Childhood Pal",christopher_moore biff messiah joshua tragic story biff birth jesus jesus chronicled
t.h._white,the_once_and_future_king,https://images.gr-assets.com/books/1338741283l/43545.jpg,T.H. White,The Once and Future King,t.h._white arthur king time arthur plots arthur arthur reign britons arthur
ki_longfellow,flow_down_like_silver:_hypatia_of_alexandria,https://images.gr-assets.com/books/1348371147l/6801755.jpg,Ki Longfellow,Flow Down Like Silver: Hypatia of Alexandria,ki_longfellow magdalene written hypatia famed magdalene longfellow author secret magdalene
stephen_king,misery,https://images.gr-assets.com/books/1270545451l/10614.jpg,Stephen King,Misery,stephen_king novelist book annie heroine misery misery chastain sheldon prisoner
jon_krakauer,into_the_wild,https://images.gr-assets.com/books/1403173986l/1845.jpg,Jon Krakauer,Into the Wild,jon_krakauer unforgettable story mccandless roamed 1991 mccandless vanished wild body mccandless
william_shakespeare,king_lear,https://images.gr-assets.com/books/1331563731l/12938.jpg,William Shakespeare,King Lear,william_shakespeare cordelia lear king lear daughter cordelia cordelia lear growing
fyodor_dostoyevsky constance_garnett alan_myers joseph_frank anna_brailovsky,the_idiot,https://images.gr-assets.com/books/1327865902l/12505.jpg,Fyodor Dostoyevsky|Constance Garnett|Alan Myers|Joseph Frank|Anna Brailovsky,The Idiot,fyodor_dostoyevsky constance_garnett alan_myers joseph_frank anna_brailovsky russia sanitarium garnett translation returning russia novel translation anna
laurie_halse_anderson,speak,https://images.gr-assets.com/books/1310121762l/439288.jpg,Laurie Halse Anderson,Speak,laurie_halse_anderson melinda fights vindication laurie heroine bitterly believable heroine laurie
diana_wynne_jones,howl's_moving_castle,https://images.gr-assets.com/books/1407450489l/6294.jpg,Diana Wynne Jones,Howl's Moving Castle,diana_wynne_jones waste sophie enchantment sophie sophie finds sophie howl castle
marissa_meyer,cinder,https://images.gr-assets.com/books/1470056948l/11235712.jpg,Marissa Meyer,Cinder,marissa_meyer illness cinder prince cinder cinder suspects cinder daughter cinder stepmother
neil_gaiman,neverwhere,https://images.gr-assets.com/books/1348747943l/14497.jpg,Neil Gaiman,Neverwhere,neil_gaiman streets london london place london going london richard mayhew
elizabeth_kostova,the_historian,https://images.gr-assets.com/books/1338298031l/10692.jpg,Elizabeth Kostova,The Historian,elizabeth_kostova mother mysterious ancient book father library secrets father labyrinth secrets
harriet_beecher_stowe,uncle_tom's_cabin,https://images.gr-assets.com/books/1414349231l/46787.jpg,Harriet Beecher Stowe,Uncle Tom's Cabin,harriet_beecher_stowe stowe puritanical history stowe stowe classic stowe incompatible slavery
ralph_ellison,invisible_man,https://images.gr-assets.com/books/1352854247l/16981.jpg,Ralph Ellison,Invisible Man,ralph_ellison ellison nightmare ralph ellison invisible man american literature rare novels
roald_dahl quentin_blake,james_and_the_giant_peach,https://images.gr-assets.com/books/1320412586l/6689.jpg,Roald Dahl|Quentin Blake,James and the Giant Peach,roald_dahl quentin_blake peach tree peach household stem peach old peach peach
cornelia_funke anthea_bell,inkheart,https://images.gr-assets.com/books/1538266636l/28194.jpg,Cornelia Funke|Anthea Bell,Inkheart,cornelia_funke anthea_bell books meggie paperback cruel storyteller cornelia tale books books imagination
james_herriot,all_creatures_great_and_small,https://images.gr-assets.com/books/1385661387l/18929854.jpg,James Herriot,All Creatures Great and Small,james_herriot animals herriot enlightening herriot herriot roamed veterinarian menagerie beloved veterinarian
walt_whitman,leaves_of_grass,https://images.gr-assets.com/books/1418012204l/27494.jpg,Walt Whitman,Leaves of Grass,walt_whitman walt whitman authorized whitman whitman final called whitman whitman
diane_setterfield,the_thirteenth_tale,https://images.gr-assets.com/books/1346267826l/40440.jpg,Diane Setterfield,The Thirteenth Tale,diane_setterfield vida storytelling mythologize birth author vida vida winter children mythologize
kristin_cashore,graceling,https://images.gr-assets.com/books/1331548394l/3236307.jpg,Kristin Cashore,Graceling,kristin_cashore katsa katsa able author kristin kristin cashore kristin
voltaire,candide,https://images.gr-assets.com/books/1345060082l/19380.jpg,Voltaire,Candide,voltaire candide story storytelling candide candide voltaire candide world takes candide
john_irving,the_cider_house_rules,https://images.gr-assets.com/books/1327962519l/4687.jpg,John Irving,The Cider House Rules,john_irving larch abortion larch homer dr larch larch physician birth orphanage
john_milton john______leonard,paradise_lost,https://images.gr-assets.com/books/1526070678l/15997.jpg,John Milton|John      Leonard,Paradise Lost,john_milton john______leonard paradise lost john milton milton paradise epic poems paradise
tim_o'brien,the_things_they_carried,https://images.gr-assets.com/books/1424663847l/133518.jpg,Tim O'Brien,The Things They Carried,tim_o'brien novel vietnam fiction vietnam vietnam brien vietnam war jungles vietnam
stephen_king,different_seasons,https://images.gr-assets.com/books/1329662611l/39662.jpg,Stephen King,Different Seasons,stephen_king shawshank redemption hayworth shawshank shawshank nominee shawshank novellas stephen
arthur_conan_doyle,"the_complete_sherlock_holmes,_vol_1",https://images.gr-assets.com/books/1512062096l/188572.jpg,Arthur Conan Doyle,"The Complete Sherlock Holmes, Vol 1",arthur_conan_doyle sherlock holmes scarlet sherlock holmes enthralled holmes sherlock
johanna_spyri beverly_cleary angelo__rinaldi,heidi,https://images.gr-assets.com/books/1388462714l/93.jpg,Johanna Spyri|Beverly Cleary|Angelo  Rinaldi,Heidi,johanna_spyri beverly_cleary angelo__rinaldi orphan heidi mountain heidi heidi goes heidi little orphan
isaac_asimov,foundation,https://images.gr-assets.com/books/1417900846l/29579.jpg,Isaac Asimov,Foundation,isaac_asimov mankind seldon galactic empire empire mankind empire ruled empire scientists
judy_blume,"are_you_there_god?_it's_me,_margaret",https://images.gr-assets.com/books/1388356524l/37732.jpg,Judy Blume,"Are You There God? It's Me, Margaret",judy_blume know margaret crush margaret believe margaret margaret margaret doesn
henry_david_thoreau,walden,https://images.gr-assets.com/books/1465675526l/16902.jpg,Henry David Thoreau,Walden,henry_david_thoreau text walden 1854 walden walden life work walden walden material
kate_chopin,the_awakening,https://images.gr-assets.com/books/1170507247l/58345.jpg,Kate Chopin,The Awakening,kate_chopin infidelity theme romantic fiction marital infidelity infidelity victorian romantic
h.g._wells greg_bear carlo_pagetti,the_time_machine,https://images.gr-assets.com/books/1327942880l/2493.jpg,H.G. Wells|Greg Bear|Carlo Pagetti,The Time Machine,h.g._wells greg_bear carlo_pagetti time traveller imagination wells time machine 1895 masterpiece fiction speculative
donna_tartt,the_secret_history,https://images.gr-assets.com/books/1451554846l/29044.jpg,Donna Tartt,The Secret History,donna_tartt charismatic classics classics professor obsession corruption charismatic contemporaries
william_styron,sophie's_choice,https://images.gr-assets.com/books/1356714742l/228560.jpg,William Styron,Sophie's Choice,william_styron wants writer writer writer turbulent stories turbulent love
cassandra_clare,city_of_lost_souls,https://images.gr-assets.com/books/1460477703l/8755776.jpg,Cassandra Clare,City of Lost Souls,cassandra_clare jace clary clary simon clary meet clary clary plays
jostein_gaarder مهرداد_بازیاری paulette_møller,sophie's_world,https://images.gr-assets.com/books/1343459906l/10959.jpg,Jostein Gaarder|مهرداد بازیاری|Paulette Møller,Sophie's World,jostein_gaarder مهرداد_بازیاری paulette_møller riddle sophie sophie amundsen sophie obsessed beginning sophie sophie
haruki_murakami jay_rubin,norwegian_wood,https://images.gr-assets.com/books/1386924361l/11297.jpg,Haruki Murakami|Jay Rubin,Norwegian Wood,haruki_murakami jay_rubin devoted naoko naoko beautiful naoko naoko finds student tokyo
pat_conroy,the_prince_of_tides,https://images.gr-assets.com/books/1512744907l/16735.jpg,Pat Conroy,The Prince of Tides,pat_conroy tom wingo pat conroy tides pat prince tides novel
jon_stone michael_j._smollin,the_monster_at_the_end_of_this_book,https://images.gr-assets.com/books/1388193494l/44186.jpg,Jon Stone|Michael J. Smollin,The Monster at the End of this Book,jon_stone michael_j._smollin monster grover old grover grover grover begs golden book
charlaine_harris,dead_until_dark,https://images.gr-assets.com/books/1468560853l/301082.jpg,Charlaine Harris,Dead Until Dark,charlaine_harris sookie stackhouse vampire boyfriend sookie having vampire vampire dreams
fannie_flagg,fried_green_tomatoes_at_the_whistle_stop_cafe,https://images.gr-assets.com/books/1165961740l/9375.jpg,Fannie Flagg,Fried Green Tomatoes at the Whistle Stop Cafe,fannie_flagg story evelyn mrs threadgoode story women age tale women 1980s
e.l._james,fifty_shades_darker,https://images.gr-assets.com/books/1358266080l/11857408.jpg,E.L. James,Fifty Shades Darker,e.l._james shades trilogy affair anastasia anastasia resist grey anastasia anastasia
haruki_murakami philip_gabriel,kafka_on_the_shore,https://images.gr-assets.com/books/1429638085l/4929.jpg,Haruki Murakami|Philip Gabriel,Kafka on the Shore,haruki_murakami philip_gabriel kafka shore boy kafka kafka murder kafka kafka tamura
helen_fielding,bridget_jones's_diary,https://images.gr-assets.com/books/1292060045l/227443.jpg,Helen Fielding,Bridget Jones's Diary,helen_fielding bridget helpless optimistic bridget bridget jones useless bridget bridget
patrick_rothfuss,the_wise_man's_fear,https://images.gr-assets.com/books/1452624392l/1215032.jpg,Patrick Rothfuss,The Wise Man's Fear,patrick_rothfuss fantasy literature tale hero nobility forces noble kvothe literature wise
j.d._salinger,franny_and_zooey,https://images.gr-assets.com/books/1355037988l/5113.jpg,J.D. Salinger,Franny and Zooey,j.d._salinger glass stories novella zooey zooey stories story franny zooey glass
bryce_courtenay,the_power_of_one,https://images.gr-assets.com/books/1388184360l/122.jpg,Bryce Courtenay,The Power of One,bryce_courtenay apartheid apartheid root 1939 hitler hitler seeds apartheid
rainbow_rowell,fangirl,https://images.gr-assets.com/books/1355886270l/16068905.jpg,Rainbow Rowell,Fangirl,rainbow_rowell writing simon cath simon cath sister sister wren simon snow
chinua_achebe,things_fall_apart,https://images.gr-assets.com/books/1352082529l/37781.jpg,Chinua Achebe,Things Fall Apart,chinua_achebe nigeria stories african experience okonkwo fall okonkwo world destruction okonkwo
rick_riordan,the_son_of_neptune,https://images.gr-assets.com/books/1464201114l/9520360.jpg,Rick Riordan,The Son of Neptune,rick_riordan percy confused percy manages percy pocket percy hazel supposed
george_eliot michel_faber,middlemarch,https://images.gr-assets.com/books/1481264628l/19089.jpg,George Eliot|Michel Faber,Middlemarch,george_eliot michel_faber literature dorothea 1832 middlemarch artist ladislaw dorothea brooke portraits english
anne_frank eleanor_roosevelt b.m._mooyaart-doubleday,the_diary_of_a_young_girl,https://images.gr-assets.com/books/1537075718l/48855.jpg,Anne Frank|Eleanor Roosevelt|B.M. Mooyaart-Doubleday,The Diary of a Young Girl,anne_frank eleanor_roosevelt b.m._mooyaart-doubleday anne frank anne writes anne meet anne anne real
c.s._lewis,the_magician's_nephew,https://images.gr-assets.com/books/1308814770l/65605.jpg,C.S. Lewis,The Magician's Nephew,c.s._lewis adventure digory secret passage passage house world adventure fascinating adventurenarnia
gillian_flynn,gone_girl,https://images.gr-assets.com/books/1397056917l/19288043.jpg,Gillian Flynn,Gone Girl,gillian_flynn behavior nick nick amy nick nick oddly nick isn
neil_gaiman,stardust,https://images.gr-assets.com/books/1459127484l/16793.jpg,Neil Gaiman,Stardust,neil_gaiman tristran thorn town wall ancient wall thorn lost wall world
bill_bryson,a_short_history_of_nearly_everything,https://images.gr-assets.com/books/1433086293l/21.jpg,Bill Bryson,A Short History of Nearly Everything,bill_bryson knowledge bryson civilization bryson bryson seeks bryson bryson biggest
kazuo_ishiguro,never_let_me_go,https://images.gr-assets.com/books/1353048590l/6334.jpg,Kazuo Ishiguro,Never Let Me Go,kazuo_ishiguro hailsham kathy truth hailsham hailsham hailsham let hailsham like
virginia_woolf maureen_howard,mrs._dalloway,https://images.gr-assets.com/books/1479336522l/14942.jpg,Virginia Woolf|Maureen Howard,Mrs. Dalloway,virginia_woolf maureen_howard dalloway woolf mrs dalloway clarissa dalloway dalloway chronicles dalloway day
john_grisham,a_time_to_kill,https://images.gr-assets.com/books/1390195915l/32542.jpg,John Grisham,A Time to Kill,john_grisham grisham wrote justice available courtroom drama searing courtroom story retribution
ann_patchett,bel_canto,https://images.gr-assets.com/books/1352997328l/5826.jpg,Ann Patchett,Bel Canto,ann_patchett international hostages hostages hostages russian hostages captors awry hostages
jonathan_swift robert_demaria_jr.,gulliver's_travels,https://images.gr-assets.com/books/1427829692l/7733.jpg,Jonathan Swift|Robert DeMaria Jr.,Gulliver's Travels,jonathan_swift robert_demaria_jr. gulliver travels 1726 reproduces 1726 edition 1726 gulliver wakes
jane_austen,the_complete_novels,https://images.gr-assets.com/books/1388178574l/14905.jpg,Jane Austen,The Complete Novels,jane_austen novels emma emma mansfield pride prejudice sensibility pride mansfield park
charles_frazier,cold_mountain,https://images.gr-assets.com/books/1442416348l/10920.jpg,Charles Frazier,Cold Mountain,charles_frazier mountain novel mountain tale cold mountain novel soldier mountain
e.l._james,fifty_shades_freed,https://images.gr-assets.com/books/1336418837l/13536860.jpg,E.L. James,Fifty Shades Freed,e.l._james ana christian anastasia steele anastasia student anastasia christian grey
garth_stein,the_art_of_racing_in_the_rain,https://images.gr-assets.com/books/1377206302l/3153910.jpg,Garth Stein,The Art of Racing in the Rain,garth_stein denny enzo enzo enzo knows enzo takes death enzo
gayle_forman,if_i_stay,https://images.gr-assets.com/books/1347462970l/4374400.jpg,Gayle Forman,If I Stay,gayle_forman beautiful book librarian note cover edition choices seventeen librarian
robert_munsch sheila_mcgraw,love_you_forever,https://images.gr-assets.com/books/1348832754l/310259.jpg,Robert Munsch|Sheila McGraw,Love You Forever,robert_munsch sheila_mcgraw parent feels love parent munsch gentle feels child robert munsch
lois_lowry,number_the_stars,https://images.gr-assets.com/books/1370917812l/47281.jpg,Lois Lowry,Number the Stars,lois_lowry annemarie johansen old annemarie annemarie life copenhagen soon annemarie
